{
  "$schema": "http://json-schema.org/draft-07/schema#",
  "title": "ProjectionConfig",
  "type": "object",
  "properties": {
    "fields": {
      "type": "array",
      "items": {
        "type": "object",
        "properties": {
          "path": { "type": "string" },
          "from": { "type": "string" },
          "type": { "type": "string" },
          "required": { "type": "boolean" },
          "normalize": { "type": "string" }
        },
        "required": ["path"],
        "additionalProperties": false
      }
    },
    "include_confidence": { "type": "boolean" },
    "include_provenance": { "type": "boolean" },
    "on_missing": { "type": "string", "enum": ["null", "omit", "error"] }
  },
  "required": ["fields"],
  "additionalProperties": false
}
