{
  "fields": [
    { "path": "full_name", "type": "string", "required": true },
    { "path": "primary_email", "from": "emails[0]", "type": "string", "required": true },
    { "path": "phone", "from": "phones[0]", "type": "string", "normalize": "E164" },
    { "path": "skills", "from": "skills[].name", "type": "string[]", "normalize": "canonical" }
  ],
  "include_confidence": true,
  "include_provenance": false,
  "on_missing": "null"
}
